{
  "$ref": "#/definitions/pages",
  "definitions": {
    "pages": {
      "type": "object",
      "properties": {
        "title": {
          "type": "string"
        },
        "description": {
          "type": "string"
        },
        "slug": {
          "type": "string"
        },
        "sections": {
          "type": "array"
        },
        "$schema": {
          "type": "string"
        }
      },
      "required": [
        "title",
        "description",
        "sections"
      ],
      "additionalProperties": false
    }
  },
  "$schema": "http://json-schema.org/draft-07/schema#"
}