{
  "title": "Services de Consultation en Opérations",
  "description": "Découvrez comment Cogesto Consulting peut optimiser vos opérations pour une efficacité accrue.",
  "sections": [
    {
      "component": "HeroMultiTemplate",
      "title": "Opérations : Optimisez pour Performer",
      "introduction": "Dans un monde des affaires en constante évolution, l'optimisation des opérations est essentielle pour garantir le succès.",
      "ctaText": "Contactez-nous",
      "ctaHref": "/contact/",
      "imageUrl": "https://example.com/image-url.jpg",
      "backgroundColor": "secondary-color"
    },
    {
      "component": "LeftTitledIntro",
      "title": "Notre Vision",
      "content": "Les opérations ne sont pas simplement un outil, elles constituent le socle de toute entreprise prospère. Nous aidons nos clients à naviguer à travers les défis modernes grâce à des méthodologies éprouvées."
    },
    {
      "component": "BodyCopyImage",
      "title": "Modèle #OPERA 2030",
      "description": "Notre modèle unique, #OPERA 2030, offre une approche stratégique qui intègre cinq perspectives clés des opérations pour favoriser l'agilité et la résilience.",
      "imageUrl": "https://example.com/opera2030-image.jpg",
      "imageAlt": "Modèle OPERA 2030",
      "buttonText": "Découvrez OPERA",
      "buttonHref": "/opera2030",
      "reverseLayout": false
    },
    {
      "component": "CardGrid",
      "heading": "Nos Services",
      "items": [
        {
          "heading": "Stratégie d'Opérations",
          "text": "Élaborons ensemble une stratégie d’opérations qui répond aux défis de votre marché.",
          "link": "/strategie-operations",
          "style": "light",
          "imageUrl": "https://example.com/strategy-image.jpg"
        },
        {
          "heading": "Digitalisation des Processus",
          "text": "Exploitez la puissance de la digitalisation pour transformer vos opérations.",
          "link": "/digitalisation",
          "style": "light",
          "imageUrl": "https://example.com/digitalisation-image.jpg"
        },
        {
          "heading": "Amélioration Continue",
          "text": "Mettez en œuvre des pratiques d’amélioration continue pour maximiser l’efficacité.",
          "link": "/amelioration-continue",
          "style": "light",
          "imageUrl": "https://example.com/improvement-image.jpg"
        }
      ]
    },
    {
      "component": "StatsSection",
      "intro": "Nos résultats parlent d'eux-mêmes.",
      "stats": [
        {
          "number": "250+",
          "label": "Projets réalisés"
        },
        {
          "number": "98%",
          "label": "Clients satisfaits"
        },
        {
          "number": "30%",
          "label": "Réduction des coûts"
        }
      ]
    },
    {
      "component": "CardImageText",
      "title": "Témoignage Client",
      "description": "Grâce à Cogesto Consulting, nous avons optimisé notre chaîne de valeur, entraînant des économies significatives.",
      "buttonText": "Lire plus de témoignages",
      "buttonHref": "/temoignages",
      "imageUrl": "https://example.com/testimonial-image.jpg",
      "imageAlt": "Témoignage",
      "videoPosition": "right",
      "backgroundColorClass": "bg-secondary-color"
    }
  ],
  "slug": "operations-consulting"
}