{
  "title": "Commodity Trading Analytics | Wood Mackenzie",
  "description": "Access real-time data and analytics in all major commodities with innovative datapoints and comprehensive insights.",
  "slug": "industry/commodity-trading-analytics",
  "sections": [
    {
      "component": "HeroMultiTemplate",
      "title": "Commodity Trading Analytics",
      "subtitle": "Real-time monitoring and advanced analytics, providing the insights to identify opportunities and manage risk.",
      "theme": "cobalt",
      "backgroundImage": "https://www.woodmac.com/siteassets/frontify_media_download/photography/refining-and-oil-products/_macro/macro_refining_gettyimages-509465699.jpg?width=1000&height=680&rmode=crop&rxy=0.5,0.5"
    },
    {
      "component": "BodyCopyImage",
      "heading": "A new era of volatility and opportunity in commodity markets",
      "text_content": "<p>Commodity markets are entering a period of rapid change, driven by shifting demand patterns, evolving supply chains, and new pressures from policy and energy security concerns.</p><p>Volatility creates both risk and opportunity, making real-time visibility into infrastructure, trade flows, and price signals more critical than ever.</p>",
      "imageSrc": "https://www.woodmac.com/siteassets/frontify_media_download/photography/gas/micro-gas/micro_gas_gettyimages-869963568.jpg?width=1000&rmode=crop&rxy=0.5,0.5",
      "imagePosition": "right"
    },
    {
      "component": "TwoColumnContent",
      "title": "Why choose Wood Mackenzie?",
      "paragraphs": [
        "Leverage data and advanced analytics from our proprietary monitoring network – combining live camera feeds, infrared, satellite imagery and power line measurements – combined with expert insights across oil, gas & LNG, and power markets.",
        "Our offerings combine real-time monitoring and forecasting, making them essential for IOCs and NOCs to small operators, banks, trading houses and hedge funds."
      ],
      "imagePosition": "left"
    },
    {
      "component": "CardGrid",
      "heading": "Find the right product for your needs",
      "items": [
        {
          "title": "Oil Supply & Forecast",
          "description": "Our suite provides detailed refinery crude runs forecasts in North America.",
          "link": "/industry/commodity-trading-analytics/oil-supply-and-forecast/"
        },
        {
          "title": "Oil & Gas Transportation",
          "description": "Deliver critical insights into pipeline flows, inventory levels, and regional supply-demand trends.",
          "link": "/industry/commodity-trading-analytics/oil-gas-transportation-pipelines-storage/"
        },
        {
          "title": "Oil Refining",
          "description": "Tracking conversions from crude to renewable feedstocks in real-time.",
          "link": "/industry/commodity-trading-analytics/oil-refining/"
        },
        {
          "title": "Natural Gas Analytics",
          "description": "Deliver essential insights and analytics to empower confident decision-making.",
          "link": "/industry/commodity-trading-analytics/natural-gas-analytics/"
        },
        {
          "title": "NGLs & Petrochemicals",
          "description": "Accurate data and forecasts they need to complement and inform their models.",
          "link": "/industry/commodity-trading-analytics/ngls-and-petrochemicals/"
        },
        {
          "title": "Natural Gas Supply & Demand",
          "description": "Guide your trading strategy with data and insights that help you understand market movements.",
          "link": "/industry/commodity-trading-analytics/natural-gas-supply-demand/"
        }
      ]
    },
    {
      "component": "CardGrid",
      "heading": "Trading moments",
      "items": [
        {
          "title": "Benicia refinery fire",
          "description": "On May 5, 2025, a fire at the Benicia refinery located northeast of San Francisco was detected via our sensor network.",
          "link": "https://go.woodmac.com/l/131501/2025-06-16/34gjbw",
          "icon_or_image": "https://www.woodmac.com/contentassets/f85fc5925cce47ccab8cb14b60ef58bb/benicia-refinery-fire.png?rmode=crop&rxy=0.5,0.5"
        },
        {
          "title": "Cameron LNG shutdown",
          "description": "On 27 October at around 1:30 Central Time, Cameron LNG shut down all three trains completely and unexpectedly.",
          "link": "https://go.woodmac.com/l/131501/2025-11-05/34zpwk",
          "icon_or_image": "https://www.woodmac.com/contentassets/b72aa1770e024fbdbb144b75ddef0ecd/lng-alert.png?rmode=crop&rxy=0.5,0.5"
        },
        {
          "title": "Storage Surge",
          "description": "In April, our European Gas Supply & Demand forecasts indicated a bearish outlook for the TTF forward curve.",
          "link": "https://go.woodmac.com/l/131501/2025-08-25/34q45g",
          "icon_or_image": "https://www.woodmac.com/contentassets/36f197f72633460695ef6ce82dbbaddf/ttf-storage-surge-update-web.png?rmode=crop&rxy=0.5,0.5"
        }
      ]
    },
    {
      "component": "BodyCopyImage",
      "heading": "Make smarter decisions",
      "text_content": "<p>Expert advisory services with a global team of consultants, leveraging the industry standard – our data and research. We support customers in finding and developing opportunities and managing risks.</p>",
      "imageSrc": "https://www.woodmac.com/siteassets/frontify_media_download/photography/people/_micro/micro_people_gettyimages-167890481.jpg?width=1000&rmode=crop&rxy=0.5,0.5",
      "imagePosition": "right"
    },
    {
      "component": "BodyCopyImage",
      "heading": "Contact an expert",
      "text_content": "<p>In a volatile market, having the right data isn’t enough. You need a partner who provides the insights and context to turn market shifts into opportunities. Get in touch with one of our experts today.</p>",
      "imageSrc": "https://www.woodmac.com/siteassets/frontify_media_download/photography/people/_micro/micro_people_gettyimages-594203323.jpg?width=1000&rmode=crop&rxy=0.5,0.5",
      "imagePosition": "left"
    },
    {
      "component": "CardGrid",
      "heading": "Explore some of our latest thinking",
      "items": [
        {
          "title": "European natural gas",
          "description": "Insights on key market trends, regional dynamics, and short-term LNG outlooks.",
          "link": "https://www.woodmac.com/news/opinion/european-natural-gas-your-top-seven-questions-answered/"
        },
        {
          "title": "5 top takeaways from APPEC",
          "description": "Our experts unpack the 5 key trends shaping Asia’s oil and refining markets in 2025 and what to expect in 2026.",
          "link": "https://www.woodmac.com/news/opinion/5-top-takeaways-from-our-appec-2025-briefings/"
        },
        {
          "title": "Japan's energy strategy",
          "description": "A renewed focus on the country’s energy infrastructure has important implications for oil and refined products.",
          "link": "https://www.woodmac.com/news/opinion/japan-sweeps-the-dust-from-its-energy-strategy/"
        }
      ]
    }
  ]
}
